{"SDK_version":"1.0.0","classifications":[{"finding_id":"fn_semgrep_16e2ebe0d791930769344f83e8bbb3c3679a1d533d06bfcf2831433fa06ece7b","mode":"blocking","policy_key":"L9-PYTHON-EXEC-USED","policy_version":"1.0.0","resolution_status":"explicit","used_default":false},{"finding_id":"fn_semgrep_c2ab8ed19fef16fbb17585c2fbebf66a5d79c78c6ceb19a7137233548d408695","mode":"advisory","policy_key":"L9-PYTHON-USELESS-COMPARISON","policy_version":"1.0.0","resolution_status":"explicit","used_default":false}],"coverage":[{"files_analyzed":1,"files_considered":1,"limitations":[],"provider_id":"semgrep","status":"complete"}],"evidence":[{"attributes":{"identity_mapping_version":"1.0.0","identity_resolution_status":"explicit_mapping","metadata":{"category":"security","confidence":"HIGH","cwe":["CWE-95"],"references":["https://example.invalid/redacted"],"technology":["python"]},"provider_severity":"ERROR"},"canonical_rule_id":"L9-PYTHON-EXEC-USED","confidence":"unknown","evidence_id":"ev_semgrep_306de871e397029aef0edf441cb0c1bdb8c71e097de6d2ed76f9c321b97a0d0c","evidence_type":"static-analysis-match","identifiers":{"semgrep_check_id":"python.lang.security.audit.exec-used.exec-used"},"limitations":[],"locations":[{"end_column":21,"end_line":4,"normalized_path":"src/example.py","start_column":5,"start_line":4}],"message":"Use of exec detected.","provider_fingerprint":"redacted-semgrep-fingerprint-001","provider_id":"semgrep","provider_rule_id":"python.lang.security.audit.exec-used.exec-used","provider_version":"fixture-version","severity":"high","snapshot_id":"snapshot-release-test"},{"attributes":{"identity_mapping_version":"1.0.0","identity_resolution_status":"explicit_mapping","metadata":{"category":"correctness","confidence":"MEDIUM","technology":["python"]},"provider_severity":"WARNING"},"canonical_rule_id":"L9-PYTHON-USELESS-COMPARISON","confidence":"unknown","evidence_id":"ev_semgrep_49fab9c0878528688972205eea65ec59cd457f312d46315137267500eb86d0cd","evidence_type":"static-analysis-match","identifiers":{"semgrep_check_id":"python.lang.correctness.useless-comparison.useless-comparison"},"limitations":[],"locations":[{"end_column":11,"end_line":8,"normalized_path":"src/example.py","start_column":5,"start_line":8}],"message":"Comparison result is unused.","provider_fingerprint":"redacted-semgrep-fingerprint-002","provider_id":"semgrep","provider_rule_id":"python.lang.correctness.useless-comparison.useless-comparison","provider_version":"fixture-version","severity":"medium","snapshot_id":"snapshot-release-test"}],"findings":[{"attributes":{"identity_resolution_status":"explicit_mapping","semgrep_check_id":"python.lang.security.audit.exec-used.exec-used"},"canonical_rule_id":"L9-PYTHON-EXEC-USED","category":"security","confidence":"unknown","evidence_ids":["ev_semgrep_306de871e397029aef0edf441cb0c1bdb8c71e097de6d2ed76f9c321b97a0d0c"],"finding_id":"fn_semgrep_16e2ebe0d791930769344f83e8bbb3c3679a1d533d06bfcf2831433fa06ece7b","fingerprint":"5bacdbf0df15ed31e18b0541d6755d215b060de070af67b840577b6f35fcf2f3","limitations":[],"locations":[{"end_column":21,"end_line":4,"normalized_path":"src/example.py","start_column":5,"start_line":4}],"message":"Use of exec detected.","provider_id":"semgrep","provider_rule_id":"python.lang.security.audit.exec-used.exec-used","severity":"high","snapshot_id":"snapshot-release-test"},{"attributes":{"identity_resolution_status":"explicit_mapping","semgrep_check_id":"python.lang.correctness.useless-comparison.useless-comparison"},"canonical_rule_id":"L9-PYTHON-USELESS-COMPARISON","category":"correctness","confidence":"unknown","evidence_ids":["ev_semgrep_49fab9c0878528688972205eea65ec59cd457f312d46315137267500eb86d0cd"],"finding_id":"fn_semgrep_c2ab8ed19fef16fbb17585c2fbebf66a5d79c78c6ceb19a7137233548d408695","fingerprint":"11fedba115afe00bd77552f5665cd3daa724947fe02749581d175e73f025298d","limitations":[],"locations":[{"end_column":11,"end_line":8,"normalized_path":"src/example.py","start_column":5,"start_line":8}],"message":"Comparison result is unused.","provider_id":"semgrep","provider_rule_id":"python.lang.correctness.useless-comparison.useless-comparison","severity":"medium","snapshot_id":"snapshot-release-test"}],"generated_at":"2026-07-17T00:00:00Z","limitations":[],"provider_failures":[],"providers":[{"adapter_version":"1.0.0","mode":"import","provider_id":"semgrep","provider_version":"fixture-version","required":true}],"schema":"l9.finding-bundle/v1","schema_version":"1.0.0","snapshot":{"repository_root":".","snapshot_id":"snapshot-release-test"},"summary":{"classification_count":2,"coverage_count":1,"evidence_count":2,"finding_count":2,"provider_count":1,"provider_failure_count":0}}
